{
  "ci_id": "20000000-0000-4000-8000-000000000003",
  "source_system": "synthetic-cmdb",
  "native_device_id": "SYNTHETIC-CI-003",
  "asset_id": "10000000-0000-4000-8000-000000000003",
  "ci_type": "storage-device",
  "aliases": [
    {
      "type": "source_native_id",
      "value": "SYNTHETIC-CI-003",
      "valid_from": "2026-07-24T00:00:00Z",
      "source": "synthetic-cmdb",
      "confidence": 1.0
    },
    {
      "type": "hostname",
      "value": "synthetic-storage-001.example.invalid",
      "valid_from": "2026-07-24T00:00:00Z",
      "source": "synthetic-cmdb",
      "confidence": 0.9
    }
  ],
  "created_at": "2026-07-24T00:00:00Z",
  "updated_at": "2026-07-24T00:00:00Z"
}
